{
  "command_id": "a0000000-0000-4000-8000-000000000001",
  "session_id": "sess-worker-playwright-01",
  "command_type": "ENSURE_SESSION",
  "timestamp_utc": "2026-08-16T12:00:00Z",
  "timeout_ms": 60000,
  "params": {
    "account_alias": "creator-account-1",
    "headless": true,
    "profile_directory": "/tmp/browser-profiles/acc-1"
  }
}
