{
  "command_id": "a0000000-0000-4000-8000-000000000004",
  "session_id": "sess-worker-playwright-01",
  "command_type": "OPEN_FLOW",
  "timestamp_utc": "2026-08-16T12:00:30Z",
  "params": {
    "flow_url": "https://flow.google.com/workspace/project-alpha",
    "wait_for_selector": "[data-testid='canvas-ready']"
  }
}
